{
    "name": "network_request",
    "extensions": [
        {
            "name": "strings",
            "version": "latest"
        }
    ],
    "variables": [
        {
            "name": "origin.ip",
            "type": "string",
            "description": "The IP address of the origin"
        },
        {
            "name": "origin.region_code",
            "type": "string",
            "description": "The two-letter ISO 3166-1 alpha-2 region code of the origin"
        },
        {
            "name": "origin.asn",
            "type": "int",
            "description": "The Autonomous System Number of the origin"
        },
        {
            "name": "request.headers",
            "type": "map<string, string>",
            "description": "The headers of the request, all header keys are lower-case"
        },
        {
            "name": "request.method",
            "type": "string",
            "description": "The HTTP method of the request, e.g. GET, POST, PUT, DELETE"
        },
        {
            "name": "request.path",
            "type": "string",
            "description": "The path of the request, e.g. /api/v1/users"
        },
        {
            "name": "request.query",
            "type": "string",
            "description": "The query string of the request, e.g. ?id=123&name=test"
        }
    ],
    "functions": [
        {
            "name": "inIpRange",
            "description": "Check if an IP address is in a given IP range",
            "overloads": [
                {
                    "id": "inIpRange_string_string",
                    "examples": [
                        "inIpRange('192.168.1.1', '192.168.1.0/24') // true"
                    ],
                    "args": ["string", "string"],
                    "return": "bool"
                }
            ]
        }
    ]
}